{"abi":{"major":1,"max_minor":0,"min_minor":0},"bundle_id":"com.example.relay-controller","bundle_semver":"0.1.0","bundle_version":1,"capabilities":[{"id":1,"kind":"gpio","max_rate_hz":10,"ops":["read","write"],"resource":"relay_1"},{"id":2,"kind":"gpio","max_rate_hz":20,"ops":["write"],"resource":"status_led"},{"id":3,"kind":"gpio","ops":["read","subscribe"],"resource":"button_1"},{"id":10,"kind":"sensor","max_rate_hz":1,"ops":["read"],"resource":"temp_ambient"},{"id":20,"kind":"network","max_payload_bytes":1024,"ops":["publish"],"resource":"mqtt_telemetry"},{"id":30,"kind":"storage","max_payload_bytes":512,"ops":["read","write"],"resource":"app_state"}],"entrypoints":{"event":"wdc_module_on_event","health":"wdc_module_health","init":"wdc_module_init","shutdown":"wdc_module_shutdown"},"limits":{"event_timeout_ms":100,"health_timeout_ms":50,"host_call_timeout_ms":50,"init_timeout_ms":2000,"linear_memory_max_bytes":131072,"max_event_bytes":2048,"max_outstanding_async_requests":4,"max_request_bytes":2048,"max_response_bytes":2048,"stack_bytes":16384},"manifest_format":1,"payload":{"sha256":"7874523a711afb0684b4915c184a789c2b506880d150243aa38dceb1c7985db3","size_bytes":330},"runtime":{"engine":"wamr","payload_kind":"wasm","wasm_features":{"shared_memory":false,"threads":false,"wasi":false}},"security_counter":1,"signature":{"alg":"hmac-sha256-dev","key_id":"dev-r6","value":"external-bundle-signature"},"target":{"board_rev_min":"c","device_class":["relay-node"],"soc":["esp32-s3"]}}
